,paperId,url,title,citationCount,influentialCitationCount,year
718,db8ef808ec93326e865353eeb9f203fd685af6f6,https://www.semanticscholar.org/paper/db8ef808ec93326e865353eeb9f203fd685af6f6,Combining Program Analysis and Statistical Language Model for Code Statement Completion,9,2,2019
719,2d42b9ec669b1c33a75c12f0156b91c387a69190,https://www.semanticscholar.org/paper/2d42b9ec669b1c33a75c12f0156b91c387a69190,Neural Language Model Based Training Data Augmentation for Weakly Supervised Early Rumor Detection,9,0,2019
720,56cafbac34f2bb3f6a9828cd228ff281b810d6bb,https://www.semanticscholar.org/paper/56cafbac34f2bb3f6a9828cd228ff281b810d6bb,KEPLER: A Unified Model for Knowledge Embedding and Pre-trained Language Representation,244,67,2019
721,66b3b67f918b35a54d91c2383b4d4f31e77cf1c9,https://www.semanticscholar.org/paper/66b3b67f918b35a54d91c2383b4d4f31e77cf1c9,Extremely Low Resource Text simplification with Pre-trained Transformer Language Model,7,0,2019
722,ee886b0b4b9208b379382a9eaed05d7b3395778d,https://www.semanticscholar.org/paper/ee886b0b4b9208b379382a9eaed05d7b3395778d,Improving Text Recognition using Optical and Language Model Writer Adaptation,6,0,2019
723,c9bbea8e9eb295ea034fa21289fc11f2212fb2f8,https://www.semanticscholar.org/paper/c9bbea8e9eb295ea034fa21289fc11f2212fb2f8,Highly Efficient Neural Network Language Model Compression Using Soft Binarization Training,5,0,2019
724,73dd65e859d2566f3755c11cb12aff518202186a,https://www.semanticscholar.org/paper/73dd65e859d2566f3755c11cb12aff518202186a,WaLDORf: Wasteless Language-model Distillation On Reading-comprehension,3,0,2019
725,a8a2c955cdcd125451f440ebd72b053588a96692,https://www.semanticscholar.org/paper/a8a2c955cdcd125451f440ebd72b053588a96692,Real Life Application of a Question Answering System Using BERT Language Model,10,0,2019
726,8761f900c5c0599976350a80b1a03bfcd631b61d,https://www.semanticscholar.org/paper/8761f900c5c0599976350a80b1a03bfcd631b61d,Extractive Summarization with Very Deep Pretrained Language Model,6,1,2019
727,a304837d021df72ccd0a7edeb69e049626ae9569,https://www.semanticscholar.org/paper/a304837d021df72ccd0a7edeb69e049626ae9569,Illustrating the Benefits of Openness: A Large-Scale Spatial Economic Dispatch Model Using the Julia Language,16,0,2019
728,222b9a7b8038120671a1610e857d3edbc7ac5550,https://www.semanticscholar.org/paper/222b9a7b8038120671a1610e857d3edbc7ac5550,Mixout: Effective Regularization to Finetune Large-scale Pretrained Language Models,105,19,2019
729,28b74bb7c8b08cceb2430ec2d54dfa0f3225d796,https://www.semanticscholar.org/paper/28b74bb7c8b08cceb2430ec2d54dfa0f3225d796,"VaTeX: A Large-Scale, High-Quality Multilingual Dataset for Video-and-Language Research",213,68,2019
730,8323c591e119eb09b28b29fd6c7bc76bd889df7a,https://www.semanticscholar.org/paper/8323c591e119eb09b28b29fd6c7bc76bd889df7a,Megatron-LM: Training Multi-Billion Parameter Language Models Using Model Parallelism,631,99,2019
731,7a064df1aeada7e69e5173f7d4c8606f4470365b,https://www.semanticscholar.org/paper/7a064df1aeada7e69e5173f7d4c8606f4470365b,ALBERT: A Lite BERT for Self-supervised Learning of Language Representations,3494,765,2019
732,c41a11c0e9b8b92b4faaf97749841170b760760a,https://www.semanticscholar.org/paper/c41a11c0e9b8b92b4faaf97749841170b760760a,VideoBERT: A Joint Model for Video and Language Representation Learning,730,62,2019
733,e0c6abdbdecf04ffac65c440da77fb9d66bb474c,https://www.semanticscholar.org/paper/e0c6abdbdecf04ffac65c440da77fb9d66bb474c,XLNet: Generalized Autoregressive Pretraining for Language Understanding,5168,816,2019
734,24d7b1487202e3aaf329df3d8135ae6eabefaa45,https://www.semanticscholar.org/paper/24d7b1487202e3aaf329df3d8135ae6eabefaa45,Speech Model Pre-training for End-to-End Spoken Language Understanding,204,53,2019
735,0cbf97173391b0430140117027edcaf1a37968c7,https://www.semanticscholar.org/paper/0cbf97173391b0430140117027edcaf1a37968c7,TinyBERT: Distilling BERT for Natural Language Understanding,827,185,2019
736,e04a80263d252a3d8a382ba37a249b9345620570,https://www.semanticscholar.org/paper/e04a80263d252a3d8a382ba37a249b9345620570,Plug and Play Language Models: A Simple Approach to Controlled Text Generation,415,114,2019
737,540f074cb6f16563a357741837e41c44c0a38234,https://www.semanticscholar.org/paper/540f074cb6f16563a357741837e41c44c0a38234,Reweighted Proximal Pruning for Large-Scale Language Representation,50,6,2019
738,65a9c7b0800c86a196bc14e7621ff895cc6ab287,https://www.semanticscholar.org/paper/65a9c7b0800c86a196bc14e7621ff895cc6ab287,ViLBERT: Pretraining Task-Agnostic Visiolinguistic Representations for Vision-and-Language Tasks,1722,303,2019
739,207da6d2c07289bf72a2b5974bb3f011ebb5dd0d,https://www.semanticscholar.org/paper/207da6d2c07289bf72a2b5974bb3f011ebb5dd0d,Adversarial NLI: A New Benchmark for Natural Language Understanding,428,114,2019
740,6648b4db5f12c30941ea78c695e77aded19672bb,https://www.semanticscholar.org/paper/6648b4db5f12c30941ea78c695e77aded19672bb,Unified Vision-Language Pre-Training for Image Captioning and VQA,471,64,2019
741,72260ed4fcb8390c27bf10048ca58849c63bc342,https://www.semanticscholar.org/paper/72260ed4fcb8390c27bf10048ca58849c63bc342,Cross-lingual Transfer Learning with Data Selection for Large-Scale Spoken Language Understanding,14,1,2019
742,06a73ad09664435f8b3cd90293f4e05a047cf375,https://www.semanticscholar.org/paper/06a73ad09664435f8b3cd90293f4e05a047cf375,K-BERT: Enabling Language Representation with Knowledge Graph,366,65,2019
743,6548a60a6bcdf6c402d9de1c05ba7afe4f49fee9,https://www.semanticscholar.org/paper/6548a60a6bcdf6c402d9de1c05ba7afe4f49fee9,12-in-1: Multi-Task Vision and Language Representation Learning,312,44,2019
744,7584c8807b425aed3951bd099105c292037809fc,https://www.semanticscholar.org/paper/7584c8807b425aed3951bd099105c292037809fc,Role Models in Language Learning: Results of a Large-Scale International Survey,17,1,2019
745,d01fa0311e8e15b8b874b376123530c815f52852,https://www.semanticscholar.org/paper/d01fa0311e8e15b8b874b376123530c815f52852,FreeLB: Enhanced Adversarial Training for Natural Language Understanding,222,49,2019
746,ab70853cd5912c470f6ff95e95481980f0a2a41b,https://www.semanticscholar.org/paper/ab70853cd5912c470f6ff95e95481980f0a2a41b,SMART: Robust and Efficient Fine-Tuning for Pre-trained Natural Language Models through Principled Regularized Optimization,219,39,2019
747,658721bc13b0fa97366d38c05a96bf0a9f4bb0ac,https://www.semanticscholar.org/paper/658721bc13b0fa97366d38c05a96bf0a9f4bb0ac,Multi-Task Deep Neural Networks for Natural Language Understanding,830,197,2019
748,0fa68cde4db12779adacb70a24961cf09b1adf73,https://www.semanticscholar.org/paper/0fa68cde4db12779adacb70a24961cf09b1adf73,Language-Driven Temporal Activity Localization: A Semantic Matching Reinforcement Learning Model,114,17,2019
749,2ea64b7c7617f6cc1768373124ca0243d772a90f,https://www.semanticscholar.org/paper/2ea64b7c7617f6cc1768373124ca0243d772a90f,Social Bias Frames: Reasoning about Social and Power Implications of Language,190,38,2019
750,5cf3e46e6d427a87726c18f22def612519176938,https://www.semanticscholar.org/paper/5cf3e46e6d427a87726c18f22def612519176938,Large-Scale Multilingual Speech Recognition with a Streaming End-to-End Model,104,7,2019
751,8743750be78ec51a9042768aa6e8c96a61431b99,https://www.semanticscholar.org/paper/8743750be78ec51a9042768aa6e8c96a61431b99,Using Morphological Data in Language Modeling for Serbian Large Vocabulary Speech Recognition,8,0,2019
752,56487ba862fdbc0e0680b0008094a5d061ff74fe,https://www.semanticscholar.org/paper/56487ba862fdbc0e0680b0008094a5d061ff74fe,LSTM-Based Language Models for Very Large Vocabulary Continuous Russian Speech Recognition System,4,0,2019
753,82a325aa046770ccafa9a7c302a648bb4ce05b79,https://www.semanticscholar.org/paper/82a325aa046770ccafa9a7c302a648bb4ce05b79,VetTag: improving automated veterinary diagnosis coding via large-scale language modeling,9,0,2019
754,21d4d97fed755a9ecd5b67a42e1c69008989738c,https://www.semanticscholar.org/paper/21d4d97fed755a9ecd5b67a42e1c69008989738c,Large-scale Pretraining for Visual Dialog: A Simple State-of-the-Art Baseline,69,22,2019
755,f0f38f383e33f362774166e6ddf95b4756535426,https://www.semanticscholar.org/paper/f0f38f383e33f362774166e6ddf95b4756535426,A Distributed System for Large-scale n-gram Language Models at Tencent,3,0,2019
756,8b2c7784bbf0d60df910e4389e1a12f1463e281d,https://www.semanticscholar.org/paper/8b2c7784bbf0d60df910e4389e1a12f1463e281d,Natural Language Processing in Large-Scale Neural Models for Medical Screenings,3,0,2019
757,ba511aa8390e4a48e4a8273d9e24c35bcfe4cd96,https://www.semanticscholar.org/paper/ba511aa8390e4a48e4a8273d9e24c35bcfe4cd96,Word2Vec model for sentiment analysis of product reviews in Indonesian language,34,5,2019
758,5f994dc8cae24ca9d1ed629e517fcc652660ddde,https://www.semanticscholar.org/paper/5f994dc8cae24ca9d1ed629e517fcc652660ddde,ERNIE: Enhanced Language Representation with Informative Entities,753,146,2019
759,734d1c1ba6da1412be47abaeaffed8ddb8f3c403,https://www.semanticscholar.org/paper/734d1c1ba6da1412be47abaeaffed8ddb8f3c403,"Towards a Comprehensive, Empirical Model of Language Assessment Literacy across Stakeholder Groups: Developing the Language Assessment Literacy Survey",44,5,2019
760,7a31e2dcbaa1cf6e9f76084793a02a2a4e4c2d15,https://www.semanticscholar.org/paper/7a31e2dcbaa1cf6e9f76084793a02a2a4e4c2d15,Deeper Text Understanding for IR with Contextual Neural Language Modeling,292,44,2019
761,ef2d4dac9c0b2919737af9c0b087e793cc438a7e,https://www.semanticscholar.org/paper/ef2d4dac9c0b2919737af9c0b087e793cc438a7e,hpiDEDIS at GermEval 2019: Offensive Language Identification using a German BERT model,25,2,2019
762,5d22b241836e30d5b0d852b463951ab7e3245ea4,https://www.semanticscholar.org/paper/5d22b241836e30d5b0d852b463951ab7e3245ea4,Reducing Sentiment Bias in Language Models via Counterfactual Evaluation,85,13,2019
763,949fef650da4c41afe6049a183b504b3cc91f4bd,https://www.semanticscholar.org/paper/949fef650da4c41afe6049a183b504b3cc91f4bd,Multimodal Transformer for Unaligned Multimodal Language Sequences,406,92,2019
764,90c1dd257ec64d6ca34c25cec740c429e7f68239,https://www.semanticscholar.org/paper/90c1dd257ec64d6ca34c25cec740c429e7f68239,JParaCrawl: A Large Scale Web-Based English-Japanese Parallel Corpus,38,3,2019
765,bbde0f942a2541437e3edd55941ddafba6c5adb0,https://www.semanticscholar.org/paper/bbde0f942a2541437e3edd55941ddafba6c5adb0,Transformers : State-ofthe-art Natural Language Processing,331,11,2019
766,157a7ae44613a1fcf34e2be8c1e19a4f6e3c50e3,https://www.semanticscholar.org/paper/157a7ae44613a1fcf34e2be8c1e19a4f6e3c50e3,Transfer Learning in Natural Language Processing,263,14,2019
767,a0ff692a03f8ed4b6831baba6cd51dc245ebc706,https://www.semanticscholar.org/paper/a0ff692a03f8ed4b6831baba6cd51dc245ebc706,Interactive Learning of Teacher-student Model for Short Utterance Spoken Language Identification,8,2,2019
768,bf442ab269074665a68e4dbbe19e4efc97862541,https://www.semanticscholar.org/paper/bf442ab269074665a68e4dbbe19e4efc97862541,Large Memory Layers with Product Keys,85,10,2019
769,432eb11c275a4891e06c144a9854bb0db63973c1,https://www.semanticscholar.org/paper/432eb11c275a4891e06c144a9854bb0db63973c1,Generating Sentiment-Preserving Fake Online Reviews Using Neural Language Models and Their Human- and Machine-based Detection,42,8,2019
770,c33b69855e03958f1d9d3cff7abd2eb2184ecd52,https://www.semanticscholar.org/paper/c33b69855e03958f1d9d3cff7abd2eb2184ecd52,Fine-Tuning Bidirectional Encoder Representations From Transformers (BERT)–Based Models on Large-Scale Electronic Health Record Notes: An Empirical Study,90,3,2019
771,4f0153b665977c3b4a6c9e5305f13f71a7d026ee,https://www.semanticscholar.org/paper/4f0153b665977c3b4a6c9e5305f13f71a7d026ee,Effective Utilization of External Knowledge and History Context in Multi-turn Spoken Language Understanding Model,7,3,2019
772,82cc671322220ceedc88a44a642c074f77676e37,https://www.semanticscholar.org/paper/82cc671322220ceedc88a44a642c074f77676e37,A Sustainable and Open Access Knowledge Organization Model to Preserve Cultural Heritage and Language Diversity,5,1,2019
773,c7462e0ee928f095a7fc40b91f1e7557d283ae8e,https://www.semanticscholar.org/paper/c7462e0ee928f095a7fc40b91f1e7557d283ae8e,Release Strategies and the Social Impacts of Language Models,130,19,2019
774,68d6038606aaecd136c07f9bde81a995f0446656,https://www.semanticscholar.org/paper/68d6038606aaecd136c07f9bde81a995f0446656,Locale-agnostic Universal Domain Classification Model in Spoken Language Understanding,6,0,2019
775,d53733e06efd8fb53e584605ee601af0394d9c3d,https://www.semanticscholar.org/paper/d53733e06efd8fb53e584605ee601af0394d9c3d,A Stack-Propagation Framework with Token-Level Intent Detection for Spoken Language Understanding,141,28,2019
776,ee4036f90d7c691496c971ad611850eddcfdb195,https://www.semanticscholar.org/paper/ee4036f90d7c691496c971ad611850eddcfdb195,A Phrase Topic Model for Large-scale Corpus,3,0,2019
777,8485f5db2d78d61f6ae0083cc1185bd246cea654,https://www.semanticscholar.org/paper/8485f5db2d78d61f6ae0083cc1185bd246cea654,MonaLog: a Lightweight System for Natural Language Inference Based on Monotonicity,24,8,2019
778,ac713aebdcc06f15f8ea61e1140bb360341fdf27,https://www.semanticscholar.org/paper/ac713aebdcc06f15f8ea61e1140bb360341fdf27,Thieves on Sesame Street! Model Extraction of BERT-based APIs,97,19,2019
779,8199b4c196b09d6176816e4d7db8d6f3d65e07c1,https://www.semanticscholar.org/paper/8199b4c196b09d6176816e4d7db8d6f3d65e07c1,From English To Foreign Languages: Transferring Pre-trained Language Models,22,4,2019
780,b85fa2d6ba4f464149574ab087b61b3901f2f5d2,https://www.semanticscholar.org/paper/b85fa2d6ba4f464149574ab087b61b3901f2f5d2,Using Speech Synthesis to Train End-To-End Spoken Language Understanding Models,26,2,2019
781,a7fedf7aa07b26874c5611fe0a53446fc417e237,https://www.semanticscholar.org/paper/a7fedf7aa07b26874c5611fe0a53446fc417e237,Understanding Dyslexia Through Personalized Large-Scale Computational Models,51,1,2019
782,8ff923aa73d8b500128862f4a38921d217979d49,https://www.semanticscholar.org/paper/8ff923aa73d8b500128862f4a38921d217979d49,P2V-MAP: Mapping Market Structures for Large Retail Assortments,29,4,2019
783,578e050d6e007797d032a07e712142035f2666dc,https://www.semanticscholar.org/paper/578e050d6e007797d032a07e712142035f2666dc,An Embarrassingly Simple Approach for Transfer Learning from Pretrained Language Models,96,3,2019
784,80cf2a6af4200ecfca1c18fc89de16148f1cd4bf,https://www.semanticscholar.org/paper/80cf2a6af4200ecfca1c18fc89de16148f1cd4bf,Patient Knowledge Distillation for BERT Model Compression,451,108,2019
785,7ebed46b7f3ec913e508e6468304fcaea832eda1,https://www.semanticscholar.org/paper/7ebed46b7f3ec913e508e6468304fcaea832eda1,Improving Multi-Task Deep Neural Networks via Knowledge Distillation for Natural Language Understanding,116,21,2019
786,8cd4054b41936ba0889edc26be8969c3dc8491d8,https://www.semanticscholar.org/paper/8cd4054b41936ba0889edc26be8969c3dc8491d8,Language Models with Transformers,74,5,2019
787,ed8c4f448b10267d26c467ab57b0225cb0964552,https://www.semanticscholar.org/paper/ed8c4f448b10267d26c467ab57b0225cb0964552,WikiCREM: A Large Unsupervised Corpus for Coreference Resolution,21,3,2019
788,1f6a8e0b630cd1557fe88484622da796af79a95a,https://www.semanticscholar.org/paper/1f6a8e0b630cd1557fe88484622da796af79a95a,End-to-End Training of a Large Vocabulary End-to-End Speech Recognition System,22,0,2019
789,65650c58498c34a019bdbd422c3737a512cc4b28,https://www.semanticscholar.org/paper/65650c58498c34a019bdbd422c3737a512cc4b28,Do Massively Pretrained Language Models Make Better Storytellers?,102,15,2019
790,847a0a93ad97c8a31ef70d379517d8d72d4d9a46,https://www.semanticscholar.org/paper/847a0a93ad97c8a31ef70d379517d8d72d4d9a46,Neural language models as psycholinguistic subjects: Representations of syntactic state,100,15,2019
791,7c631971051a8922ad4423f918d72fa4834d6bd3,https://www.semanticscholar.org/paper/7c631971051a8922ad4423f918d72fa4834d6bd3,"From Motion Activity to Geo-Embeddings: Generating and Exploring Vector Representations of Locations, Traces and Visitors through Large-Scale Mobility Data",29,3,2019
792,952e48989c41629213a22676c8c143983603f810,https://www.semanticscholar.org/paper/952e48989c41629213a22676c8c143983603f810,Direct simulation of pore-scale two-phase visco-capillary flow on large digital rock images using a phase-field lattice Boltzmann method on general-purpose graphics processing units,29,0,2019
793,7bc42c1453d4cc9382924a8808a68fd8b2525453,https://www.semanticscholar.org/paper/7bc42c1453d4cc9382924a8808a68fd8b2525453,Leveraging Sentence Similarity in Natural Language Generation: Improving Beam Search using Range Voting,9,0,2019
794,df3797d17606b7bf69702f5d5748e0be3a00e36c,https://www.semanticscholar.org/paper/df3797d17606b7bf69702f5d5748e0be3a00e36c,Large Context End-to-end Automatic Speech Recognition via Extension of Hierarchical Recurrent Encoder-decoder Models,21,1,2019
795,202e24f1c7d0e022a3c756b5102cddcc5c49a2f6,https://www.semanticscholar.org/paper/202e24f1c7d0e022a3c756b5102cddcc5c49a2f6,Meta-Learning for Low-resource Natural Language Generation in Task-oriented Dialogue Systems,74,2,2019
796,d2038ced371e45aee3651c7a595c4566f4826b9f,https://www.semanticscholar.org/paper/d2038ced371e45aee3651c7a595c4566f4826b9f,FreeLB: Enhanced Adversarial Training for Language Understanding,70,19,2019
797,81b0af7afc5b3ac9457191d3e73abf7a892ea3a7,https://www.semanticscholar.org/paper/81b0af7afc5b3ac9457191d3e73abf7a892ea3a7,Federated Learning of N-Gram Language Models,50,5,2019
798,2163dbd2c06f0aa326995b59c226e40553c4c63b,https://www.semanticscholar.org/paper/2163dbd2c06f0aa326995b59c226e40553c4c63b,NLProlog: Reasoning with Weak Unification for Question Answering in Natural Language,71,10,2019
799,e84d754564c9e2ce993596370e0a1493c9c6e4b1,https://www.semanticscholar.org/paper/e84d754564c9e2ce993596370e0a1493c9c6e4b1,Improving Neural Language Modeling via Adversarial Training,73,13,2019
800,62d1a3137b01a69443bebf4d92c1990ec512a6a1,https://www.semanticscholar.org/paper/62d1a3137b01a69443bebf4d92c1990ec512a6a1,Extracting Training Data from Large Language Models,402,35,2020
801,cc50f846ed7222698d130cddbc58ed4d547914ed,https://www.semanticscholar.org/paper/cc50f846ed7222698d130cddbc58ed4d547914ed,CPM: A Large-scale Generative Chinese Pre-trained Language Model,55,4,2020
802,35dffa79dc5c511d7cda7b6c25c0562eba3a5e0c,https://www.semanticscholar.org/paper/35dffa79dc5c511d7cda7b6c25c0562eba3a5e0c,Supervised Contrastive Learning for Pre-trained Language Model Fine-tuning,194,35,2020
803,21f177988a97336a59bcb85ff19df7451b79cf5e,https://www.semanticscholar.org/paper/21f177988a97336a59bcb85ff19df7451b79cf5e,Incremental Text-to-Speech Synthesis Using Pseudo Lookahead With Large Pretrained Language Model,7,1,2020
804,0dde065405210ebc399c58ab6b7e843a18caad51,https://www.semanticscholar.org/paper/0dde065405210ebc399c58ab6b7e843a18caad51,CLUECorpus2020: A Large-scale Chinese Corpus for Pre-training Language Model,30,2,2020
805,832fff14d2ed50eb7969c4c4b976c35776548f56,https://www.semanticscholar.org/paper/832fff14d2ed50eb7969c4c4b976c35776548f56,REALM: Retrieval-Augmented Language Model Pre-Training,519,91,2020
806,72cdd6ebe0221fb568ef20534f44ba5b35190a56,https://www.semanticscholar.org/paper/72cdd6ebe0221fb568ef20534f44ba5b35190a56,BERTweet: A pre-trained language model for English Tweets,350,102,2020
807,59a7d14d20130dc92b6a2551cf1a0115ff9f8bd6,https://www.semanticscholar.org/paper/59a7d14d20130dc92b6a2551cf1a0115ff9f8bd6,Audio Captioning using Pre-Trained Large-Scale Language Model Guided by Audio-based Similar Caption Retrieval,12,1,2020
808,b360427d0991143013da6a208ccf28bcc8028fab,https://www.semanticscholar.org/paper/b360427d0991143013da6a208ccf28bcc8028fab,Knowledge Graph Based Synthetic Corpus Generation for Knowledge-Enhanced Language Model Pre-training,73,14,2020
809,19803adec3b97fb2e3c8097f17bf33fabf311795,https://www.semanticscholar.org/paper/19803adec3b97fb2e3c8097f17bf33fabf311795,Fine-Tuning Pre-trained Language Model with Weak Supervision: A Contrastive-Regularized Self-Training Approach,54,6,2020
810,a15421b034d3c75043190bbe4de28540f403f99c,https://www.semanticscholar.org/paper/a15421b034d3c75043190bbe4de28540f403f99c,Universal Sentence Representation Learning with Conditional Masked Language Model,21,5,2020
811,b01b962620a1627dbdd0d202eda9e7185fa8f2e0,https://www.semanticscholar.org/paper/b01b962620a1627dbdd0d202eda9e7185fa8f2e0,Highly accurate classification of chest radiographic reports using a deep learning natural language model pre-trained on 3.8 million text reports,21,5,2020
812,5d4cbdd2172039b84b8628f1a2f77b83ba1fa551,https://www.semanticscholar.org/paper/5d4cbdd2172039b84b8628f1a2f77b83ba1fa551,Enriching contextualized language model from knowledge graph for biomedical information extraction,28,0,2020
813,3199b35d570c17c6eedd5e538333cb3410e89b67,https://www.semanticscholar.org/paper/3199b35d570c17c6eedd5e538333cb3410e89b67,Semi-Supervised Spoken Language Understanding via Self-Supervised Speech and Language Model Pretraining,31,2,2020
814,54523ff961a1ac57a86696ef9a53b3a630b482c0,https://www.semanticscholar.org/paper/54523ff961a1ac57a86696ef9a53b3a630b482c0,Domain-Specific Language Model Pretraining for Biomedical Natural Language Processing,391,88,2020
815,b42c6cfadfaf1209346a41f1cf766f3d0c09aa3c,https://www.semanticscholar.org/paper/b42c6cfadfaf1209346a41f1cf766f3d0c09aa3c,Meta-KD: A Meta Knowledge Distillation Framework for Language Model Compression across Domains,18,1,2020
816,49cf6a22a5dac5bc98b653534af65ffa0bc0e76d,https://www.semanticscholar.org/paper/49cf6a22a5dac5bc98b653534af65ffa0bc0e76d,Multi-task Learning based Pre-trained Language Model for Code Completion,61,8,2020
817,61f42619eca0afaf2cff9a899bbdea88182885f8,https://www.semanticscholar.org/paper/61f42619eca0afaf2cff9a899bbdea88182885f8,German’s Next Language Model,100,20,2020
818,aa111c8920e963195968360f59c9de271ae470c2,https://www.semanticscholar.org/paper/aa111c8920e963195968360f59c9de271ae470c2,BROS: A PRE-TRAINED LANGUAGE MODEL,27,8,2020
819,1c8aea2bfb61f4661b6907018a5a8bca390900dd,https://www.semanticscholar.org/paper/1c8aea2bfb61f4661b6907018a5a8bca390900dd,PALM: Pre-training an Autoencoding&autoregressive Language Model for Context-conditioned Generation,32,4,2020
820,f496dca10078a5a12b71da6524014122b0039dcf,https://www.semanticscholar.org/paper/f496dca10078a5a12b71da6524014122b0039dcf,SIFRank: A New Baseline for Unsupervised Keyphrase Extraction Based on Pre-Trained Language Model,32,8,2020
821,0abb08c4ec5feab4cdd82c471866dd4395c573ce,https://www.semanticscholar.org/paper/0abb08c4ec5feab4cdd82c471866dd4395c573ce,Contrastive Distillation on Intermediate Representations for Language Model Compression,33,9,2020
822,bb393b71ee708d98f99f1666333a7cbdca2fe46b,https://www.semanticscholar.org/paper/bb393b71ee708d98f99f1666333a7cbdca2fe46b,Table Search Using a Deep Contextualized Language Model,26,3,2020
823,3578a7792904e6af3db8ffefdff86ab6a387c7c3,https://www.semanticscholar.org/paper/3578a7792904e6af3db8ffefdff86ab6a387c7c3,FinBERT: A Pretrained Language Model for Financial Communications,56,14,2020
824,3141ff49c5a70e00ccb815c638a1cc91f837e2de,https://www.semanticscholar.org/paper/3141ff49c5a70e00ccb815c638a1cc91f837e2de,Large Language Models for Latvian Named Entity Recognition,3,0,2020
825,57b4270a28adf8518da0d2621ad73e9f2a38e202,https://www.semanticscholar.org/paper/57b4270a28adf8518da0d2621ad73e9f2a38e202,Reusing a Pretrained Language Model on Languages with Limited Corpora for Unsupervised NMT,22,4,2020
826,1187c70c4011f935642084e84186284ac0add3d0,https://www.semanticscholar.org/paper/1187c70c4011f935642084e84186284ac0add3d0,Exploring Versatile Generative Language Model Via Parameter-Efficient Transfer Learning,34,7,2020
827,e7246557d6cc04bebdfbba473c130d323e415ccd,https://www.semanticscholar.org/paper/e7246557d6cc04bebdfbba473c130d323e415ccd,Language Model Prior for Low-Resource Neural Machine Translation,34,6,2020
828,c0ba595b2bef54f2552ec4716bb187901f52f4a3,https://www.semanticscholar.org/paper/c0ba595b2bef54f2552ec4716bb187901f52f4a3,KR-BERT: A Small-Scale Korean-Specific Language Model,30,7,2020
829,188003cf06acbfe2773ce9cfa4bf0517b6d459d8,https://www.semanticscholar.org/paper/188003cf06acbfe2773ce9cfa4bf0517b6d459d8,MiniVLM: A Smaller and Faster Vision-Language Model,22,4,2020
830,7c339bdee9b18af5e5db3e3dcdcdfa97d1eb8ef3,https://www.semanticscholar.org/paper/7c339bdee9b18af5e5db3e3dcdcdfa97d1eb8ef3,Unsupervised Domain Adaptation of a Pretrained Cross-Lingual Language Model,19,2,2020
831,9ba6ad0de7dbe1a3b10c44106049adb96f87d483,https://www.semanticscholar.org/paper/9ba6ad0de7dbe1a3b10c44106049adb96f87d483,KgPLM: Knowledge-guided Language Model Pre-training via Generative and Discriminative Learning,7,3,2020
832,6a47df76943f849cd47be65ee6c56a62ca38c666,https://www.semanticscholar.org/paper/6a47df76943f849cd47be65ee6c56a62ca38c666,Automatic Machine Translation Evaluation using Source Language Inputs and Cross-lingual Language Model,13,1,2020
833,f881f11a80e6911c816d8f4dfc062c039ad0a20d,https://www.semanticscholar.org/paper/f881f11a80e6911c816d8f4dfc062c039ad0a20d,Machine Translation from Spoken Language to Sign Language using Pre-trained Language Model as Encoder,9,0,2020
834,9793b07ba09d9f2ac9cabd8117daa93bf3db4346,https://www.semanticscholar.org/paper/9793b07ba09d9f2ac9cabd8117daa93bf3db4346,DEER: A Data Efficient Language Model for Event Temporal Reasoning,9,0,2020
835,23849edbce90489b29264367c855b7eb3e2275b5,https://www.semanticscholar.org/paper/23849edbce90489b29264367c855b7eb3e2275b5,An Empirical Investigation towards Efficient Multi-Domain Language Model Pre-training,7,1,2020
836,cdeb2ced6e59198d16acbf9cb025d60df9c0e087,https://www.semanticscholar.org/paper/cdeb2ced6e59198d16acbf9cb025d60df9c0e087,Fine-Tuning a Transformer-Based Language Model to Avoid Generating Non-Normative Text,7,0,2020
