,paperId,url,title,citationCount,influentialCitationCount,year,term
885,e5e443b22ad348b7d0396e2b321282682b7a271b,https://www.semanticscholar.org/paper/e5e443b22ad348b7d0396e2b321282682b7a271b,"A review on deep learning approaches in healthcare systems: Taxonomies, challenges, and open issues",76,1,2020,"large ""language model"""
886,5a3ed94cf02abc159b66d6807405a2574886bbe3,https://www.semanticscholar.org/paper/5a3ed94cf02abc159b66d6807405a2574886bbe3,Deep Learning for Person Re-Identification: A Survey and Outlook,521,54,2020,"large ""language model"""
887,7f7868fe6d4d5119f6ae5b044a0a7e08c37f0b5a,https://www.semanticscholar.org/paper/7f7868fe6d4d5119f6ae5b044a0a7e08c37f0b5a,Deep learning for biomedical photoacoustic imaging: A review,63,0,2020,"large ""language model"""
888,a5df4149c0eef991a5fc73fe9df27dc9ad671409,https://www.semanticscholar.org/paper/a5df4149c0eef991a5fc73fe9df27dc9ad671409,Deep Learning for Diabetes: A Systematic Review,24,1,2020,"large ""language model"""
889,96efa5af47c75fe90909cbceafe7524714c9e5b9,https://www.semanticscholar.org/paper/96efa5af47c75fe90909cbceafe7524714c9e5b9,Structure-preserving deep learning,23,1,2020,"large ""language model"""
890,6ebbdc79a3553e8ad2996d6d03987bfaeb448e82,https://www.semanticscholar.org/paper/6ebbdc79a3553e8ad2996d6d03987bfaeb448e82,Ansor : Generating High-Performance Tensor Programs for Deep Learning,136,29,2020,"large ""language model"""
891,77e01a9ee971b8b93a7b01c18febe62cf1e382fc,https://www.semanticscholar.org/paper/77e01a9ee971b8b93a7b01c18febe62cf1e382fc,A multi-layer and multi-ensemble stock trader using deep learning and deep reinforcement learning,50,0,2020,"large ""language model"""
892,6d04740c45d2e8a323071c9c5509481ed5663eaf,https://www.semanticscholar.org/paper/6d04740c45d2e8a323071c9c5509481ed5663eaf,Brain tumor diagnosis based on metaheuristics and deep learning,48,0,2020,"large ""language model"""
893,806e27fb9d8781c3c6e918734453418ebbeae96c,https://www.semanticscholar.org/paper/806e27fb9d8781c3c6e918734453418ebbeae96c,Prevalence of neural collapse during the terminal phase of deep learning training,124,38,2020,"large ""language model"""
894,9de96a85b6aa203c230520289252ab3cf110535b,https://www.semanticscholar.org/paper/9de96a85b6aa203c230520289252ab3cf110535b,Interpretation of deep learning in genomics and epigenomics,36,0,2020,"large ""language model"""
895,1c56023b04a6fa6cad58de4332fb7ce830e658c3,https://www.semanticscholar.org/paper/1c56023b04a6fa6cad58de4332fb7ce830e658c3,A Deep Learning System to Screen Novel Coronavirus Disease 2019 Pneumonia,591,26,2020,"large ""language model"""
896,3b57fb05ea6ba721a916c6a0410ef776f72d1f88,https://www.semanticscholar.org/paper/3b57fb05ea6ba721a916c6a0410ef776f72d1f88,TorchMD: A Deep Learning Framework for Molecular Simulations,36,1,2020,"large ""language model"""
897,7670552f0f609ef9f78e241858eb4c2770dc53ee,https://www.semanticscholar.org/paper/7670552f0f609ef9f78e241858eb4c2770dc53ee,Deep learning for predicting COVID-19 malignant progression,52,1,2020,"large ""language model"""
898,2808a637e3967e94d479f93d632e1b76030a96dc,https://www.semanticscholar.org/paper/2808a637e3967e94d479f93d632e1b76030a96dc,Comparative analysis of deep learning image detection algorithms,50,1,2020,"large ""language model"""
899,1f629ebd8a1fd77665e4aeb72dafbf5602d9ca4c,https://www.semanticscholar.org/paper/1f629ebd8a1fd77665e4aeb72dafbf5602d9ca4c,Review on remote sensing methods for landslide detection using machine and deep learning,52,2,2020,"large ""language model"""
900,0084f3cb0a1754272151c5268a783f24bf5676a0,https://www.semanticscholar.org/paper/0084f3cb0a1754272151c5268a783f24bf5676a0,"Review of deep learning: concepts, CNN architectures, challenges, applications, future directions",601,26,2021,"large ""language model"""
901,14014c024674991149f3ecf9314c93f7e029ef1a,https://www.semanticscholar.org/paper/14014c024674991149f3ecf9314c93f7e029ef1a,"Geometric Deep Learning: Grids, Groups, Graphs, Geodesics, and Gauges",341,27,2021,"large ""language model"""
902,2f65c6ac06bfcd992d4dd75f0099a072f5c3cc8c,https://www.semanticscholar.org/paper/2f65c6ac06bfcd992d4dd75f0099a072f5c3cc8c,Understanding deep learning (still) requires rethinking generalization,564,32,2021,"large ""language model"""
903,5b783ba4fa0c8f7b32139cd0f2bffa19dae83d62,https://www.semanticscholar.org/paper/5b783ba4fa0c8f7b32139cd0f2bffa19dae83d62,ProtTrans: Towards Cracking the Language of Lifes Code Through Self-Supervised Deep Learning and High Performance Computing.,178,28,2021,"large ""language model"""
904,adc61e21eafecfbf6ebecc570f9f913659a2bfb2,https://www.semanticscholar.org/paper/adc61e21eafecfbf6ebecc570f9f913659a2bfb2,Deep Learning Based Text Classification: A Comprehensive Review,325,18,2021,"large ""language model"""
905,c3df199cbca74763c4ae9889409bbd4aa29b6255,https://www.semanticscholar.org/paper/c3df199cbca74763c4ae9889409bbd4aa29b6255,Deep learning-enabled medical computer vision,203,3,2021,"large ""language model"""
906,a5b020a96cf15b07196d47a6551e90617be3cefc,https://www.semanticscholar.org/paper/a5b020a96cf15b07196d47a6551e90617be3cefc,Deep Learning Enables Accurate Diagnosis of Novel Coronavirus (COVID-19) With CT Images,226,14,2021,"large ""language model"""
907,26a1094ea12e3ea1f734e1670e6ba0e96c6b4bcf,https://www.semanticscholar.org/paper/26a1094ea12e3ea1f734e1670e6ba0e96c6b4bcf,A DEEP LEARNING APPROACH TO,178,11,2021,"large ""language model"""
908,d800bca522803c99a3ae61a2c030b6521459c523,https://www.semanticscholar.org/paper/d800bca522803c99a3ae61a2c030b6521459c523,Classification of Skin Disease Using Deep Learning Neural Networks with MobileNet V2 and LSTM,162,5,2021,"large ""language model"""
909,7d873a9c49d3864709aa762f8740edcdbd7369c5,https://www.semanticscholar.org/paper/7d873a9c49d3864709aa762f8740edcdbd7369c5,Deep learning in histopathology: the path to the clinic.,153,9,2021,"large ""language model"""
910,9d6acac70b2d1fdb861a08b00766ef263109cd7f,https://www.semanticscholar.org/paper/9d6acac70b2d1fdb861a08b00766ef263109cd7f,Sparsity in Deep Learning: Pruning and growth for efficient inference and training in neural networks,168,22,2021,"large ""language model"""
911,538fac3bc0009a9f032f420eb7577277fdf3a8bd,https://www.semanticscholar.org/paper/538fac3bc0009a9f032f420eb7577277fdf3a8bd,FakeBERT: Fake news detection in social media with a BERT-based deep learning approach,118,8,2021,"large ""language model"""
912,64aff4bac4dd205861488adade6c651085ce6b32,https://www.semanticscholar.org/paper/64aff4bac4dd205861488adade6c651085ce6b32,Machine Remaining Useful Life Prediction via an Attention-Based Deep Learning Approach,113,4,2021,"large ""language model"""
913,665a2d3289252d8f86c2ff8f98410dce2d787bed,https://www.semanticscholar.org/paper/665a2d3289252d8f86c2ff8f98410dce2d787bed,Multimodal deep learning models for early detection of Alzheimer’s disease stage,116,6,2021,"large ""language model"""
914,3b729b10a5aefd1a2be90a2f9efb03a9673b8e73,https://www.semanticscholar.org/paper/3b729b10a5aefd1a2be90a2f9efb03a9673b8e73,Deep Learning applications for COVID-19,114,3,2021,"large ""language model"""
915,40af8e077b162551888ea348d16f458a12c147e5,https://www.semanticscholar.org/paper/40af8e077b162551888ea348d16f458a12c147e5,Whole-cell segmentation of tissue images with human-level performance using large-scale data annotation and deep learning,108,7,2021,"large ""language model"""
916,0867e552c141208e6af89184fc61b9d0e494b965,https://www.semanticscholar.org/paper/0867e552c141208e6af89184fc61b9d0e494b965,Global land use / land cover with Sentinel 2 and deep learning,108,8,2021,"large ""language model"""
917,bc44c0c64a473e035b11ae60a1993ad3db1acd2e,https://www.semanticscholar.org/paper/bc44c0c64a473e035b11ae60a1993ad3db1acd2e,Deep learning: a statistical viewpoint,100,14,2021,"large ""language model"""
918,57a8464455db1baaed35c836b408757b0c76f6fa,https://www.semanticscholar.org/paper/57a8464455db1baaed35c836b408757b0c76f6fa,CADD-Splice—improving genome-wide variant effect prediction using deep learning-derived splice scores,145,14,2021,"large ""language model"""
919,60782ad3f40d13fae19fbe26b6f7c0ac5011f83d,https://www.semanticscholar.org/paper/60782ad3f40d13fae19fbe26b6f7c0ac5011f83d,Revisiting Video Saliency Prediction in the Deep Learning Era,151,15,2021,"large ""language model"""
920,87d5b61f5b6fdb0a57fc66b5c5bb428c398eaa86,https://www.semanticscholar.org/paper/87d5b61f5b6fdb0a57fc66b5c5bb428c398eaa86,Deep learning for AI,176,12,2021,"large ""language model"""
921,a56bf7ee9a56d8f84079684339a953c2df9ce76b,https://www.semanticscholar.org/paper/a56bf7ee9a56d8f84079684339a953c2df9ce76b,A review on the attention mechanism of deep learning,244,4,2021,"large ""language model"""
922,3af679c9c4f727dd4e6dc69dfde22a871e85da1e,https://www.semanticscholar.org/paper/3af679c9c4f727dd4e6dc69dfde22a871e85da1e,A survey on deep learning and its applications,166,5,2021,"large ""language model"""
923,b11468ed3a6215f1ee109fe5b2e0bd0e0e2f0eb1,https://www.semanticscholar.org/paper/b11468ed3a6215f1ee109fe5b2e0bd0e0e2f0eb1,Democratising deep learning for microscopy with ZeroCostDL4Mic,149,2,2021,"large ""language model"""
924,36881c66f8c4e733c8d16cd44b23e9c013ee666d,https://www.semanticscholar.org/paper/36881c66f8c4e733c8d16cd44b23e9c013ee666d,Fake news detection: A hybrid CNN-RNN based deep learning approach,119,4,2021,"large ""language model"""
925,fd23d4edf5fd7f9331f12e84355c5e537b5bc555,https://www.semanticscholar.org/paper/fd23d4edf5fd7f9331f12e84355c5e537b5bc555,A review of deep learning methods for semantic segmentation of remote sensing imagery,126,7,2021,"large ""language model"""
926,e420b8cd519909b4298b16d1a46fbd015c86fc4e,https://www.semanticscholar.org/paper/e420b8cd519909b4298b16d1a46fbd015c86fc4e,A physics-informed deep learning framework for inversion and surrogate modeling in solid mechanics,133,12,2021,"large ""language model"""
927,35067cc8153b7e6270797fffaefc5c9cefdfe515,https://www.semanticscholar.org/paper/35067cc8153b7e6270797fffaefc5c9cefdfe515,A Comprehensive Survey on Graph Anomaly Detection with Deep Learning,133,4,2021,"large ""language model"""
928,7a96cf43dc8b99e4da527ec645931a0033effc67,https://www.semanticscholar.org/paper/7a96cf43dc8b99e4da527ec645931a0033effc67,Plant leaf disease classification using EfficientNet deep learning model,143,5,2021,"large ""language model"""
929,c050aceb8e916d9a83e955bbd6c5a69079b96d15,https://www.semanticscholar.org/paper/c050aceb8e916d9a83e955bbd6c5a69079b96d15,A Fully Automated Deep Learning-based Network For Detecting COVID-19 from a New And Large Lung CT Scan Dataset,142,12,2021,"large ""language model"""
930,db6ad6ded1cfa26fdc7437f27fb823ec533e96fe,https://www.semanticscholar.org/paper/db6ad6ded1cfa26fdc7437f27fb823ec533e96fe,"Deep Learning: A Comprehensive Overview on Techniques, Taxonomy, Applications and Research Directions",135,1,2021,"large ""language model"""
931,e35f243b2d2c60d4c3b03379d44901dc597e175d,https://www.semanticscholar.org/paper/e35f243b2d2c60d4c3b03379d44901dc597e175d,Diagnostic accuracy of deep learning in medical imaging: a systematic review and meta-analysis,121,2,2021,"large ""language model"""
932,07ae300bb15df0fc5a2c5140bcae5773a946a296,https://www.semanticscholar.org/paper/07ae300bb15df0fc5a2c5140bcae5773a946a296,Machine learning and deep learning,140,1,2021,"large ""language model"""
933,5f573d84c83025cd7961253b55ce3bd692dec4bb,https://www.semanticscholar.org/paper/5f573d84c83025cd7961253b55ce3bd692dec4bb,Application of deep learning algorithms in geotechnical engineering: a short critical review,116,1,2021,"large ""language model"""
934,bb258e5d79ea55d9275db74268830b525367fafa,https://www.semanticscholar.org/paper/bb258e5d79ea55d9275db74268830b525367fafa,Deep-Learning-Empowered Breast Cancer Auxiliary Diagnosis for 5GB Remote E-Health,110,1,2021,"large ""language model"""
935,b415adc22ac3133c82078c987303c422c56b3b5e,https://www.semanticscholar.org/paper/b415adc22ac3133c82078c987303c422c56b3b5e,Plant diseases and pests detection based on deep learning: a review,111,2,2021,"large ""language model"""
936,e1d701aa3d540025a28693e976bbfbc628e62a54,https://www.semanticscholar.org/paper/e1d701aa3d540025a28693e976bbfbc628e62a54,Multi-Disease Prediction Based on Deep Learning: A Survey,117,0,2021,"large ""language model"""
937,a716613d9b1d31385ad955ec4770089abdc5d54c,https://www.semanticscholar.org/paper/a716613d9b1d31385ad955ec4770089abdc5d54c,Deep Learning-Based Traffic Safety Solution for a Mixture of Autonomous and Manual Vehicles in a 5G-Enabled Intelligent Transportation System,97,3,2021,"large ""language model"""
938,656f68afeb4008257a560d3d021bf35dde11423c,https://www.semanticscholar.org/paper/656f68afeb4008257a560d3d021bf35dde11423c,Efficient deep learning approach for augmented detection of Coronavirus disease,109,0,2021,"large ""language model"""
939,29409efa04ac99ccf01d2a011d21d5d14e870000,https://www.semanticscholar.org/paper/29409efa04ac99ccf01d2a011d21d5d14e870000,Artificial intelligence to deep learning: machine intelligence approach for drug discovery,105,1,2021,"large ""language model"""
940,cf6125e3fccfbce22b737cbfcb75be86e830739f,https://www.semanticscholar.org/paper/cf6125e3fccfbce22b737cbfcb75be86e830739f,Multiple features based approach for automatic fake news detection on social networks using deep learning,108,5,2021,"large ""language model"""
941,3337e4b2e63e5e99171f9da9d161771f5810c27a,https://www.semanticscholar.org/paper/3337e4b2e63e5e99171f9da9d161771f5810c27a,A Review of Deep-Learning-Based Medical Image Segmentation Methods,103,1,2021,"large ""language model"""
942,c8fc3da2d6a0a7f05e716fa3c06fc7c813c9c049,https://www.semanticscholar.org/paper/c8fc3da2d6a0a7f05e716fa3c06fc7c813c9c049,Can deep learning beat numerical weather prediction?,92,7,2021,"large ""language model"""
943,3dc0d3e76753c8a9b6c92983098ca9ab7fbdc59c,https://www.semanticscholar.org/paper/3dc0d3e76753c8a9b6c92983098ca9ab7fbdc59c,DON: Deep Learning and Optimization-Based Framework for Detection of Novel Coronavirus Disease Using X-ray Images,94,3,2021,"large ""language model"""
944,1ada57bab24abb5b0bb2bbd95765de4e0959c911,https://www.semanticscholar.org/paper/1ada57bab24abb5b0bb2bbd95765de4e0959c911,A Tutorial on Ultrareliable and Low-Latency Communications in 6G: Integrating Domain Knowledge Into Deep Learning,94,4,2021,"large ""language model"""
945,827245f658ba54aea1e708869afb5d5fdcf35768,https://www.semanticscholar.org/paper/827245f658ba54aea1e708869afb5d5fdcf35768,BinDaaS: Blockchain-Based Deep-Learning as-a-Service in Healthcare 4.0 Applications,93,4,2021,"large ""language model"""
946,79144d57d8145834bca9ca11c9327d15204ba872,https://www.semanticscholar.org/paper/79144d57d8145834bca9ca11c9327d15204ba872,Revisiting Deep Learning Models for Tabular Data,86,18,2021,"large ""language model"""
947,f67bdc515adcf5628c0a5aa15cdbf2d96d23998f,https://www.semanticscholar.org/paper/f67bdc515adcf5628c0a5aa15cdbf2d96d23998f,"Integrating deep learning CT-scan model, biological and clinical variables to predict severity of COVID-19 patients",85,4,2021,"large ""language model"""
948,bf5c05d26123415912946915a807c79125cf4c24,https://www.semanticscholar.org/paper/bf5c05d26123415912946915a807c79125cf4c24,An Edge Traffic Flow Detection Scheme Based on Deep Learning in an Intelligent Transportation System,83,3,2021,"large ""language model"""
949,4d6ff583c40619b5d30478da33b4f8b3692f0d1f,https://www.semanticscholar.org/paper/4d6ff583c40619b5d30478da33b4f8b3692f0d1f,A Hybrid Deep Learning Model With Attention-Based Conv-LSTM Networks for Short-Term Traffic Flow Prediction,84,5,2021,"large ""language model"""
950,ab970e1842159917adf588fc8455f04d45e42550,https://www.semanticscholar.org/paper/ab970e1842159917adf588fc8455f04d45e42550,Designing deep learning studies in cancer diagnostics,77,3,2021,"large ""language model"""
951,367ef4249a61343109670699611b8d663e163fe7,https://www.semanticscholar.org/paper/367ef4249a61343109670699611b8d663e163fe7,"An inflammatory aging clock (iAge) based on deep learning tracks multimorbidity, immunosenescence, frailty and cardiovascular aging.",80,4,2021,"large ""language model"""
952,4bc7bfd031b4c7dc2e52e5146ea3795acebbaff0,https://www.semanticscholar.org/paper/4bc7bfd031b4c7dc2e52e5146ea3795acebbaff0,An in silico deep learning approach to multi-epitope vaccine design: a SARS-CoV-2 case study,81,5,2021,"large ""language model"""
953,d7de3d1b53f075a83b6118426a09afe412ecae48,https://www.semanticscholar.org/paper/d7de3d1b53f075a83b6118426a09afe412ecae48,COVID-19 lung CT image segmentation using deep learning methods: U-Net versus SegNet,79,7,2021,"large ""language model"""
954,2dea66e3cf62846649b4fa3f669a148367db12a3,https://www.semanticscholar.org/paper/2dea66e3cf62846649b4fa3f669a148367db12a3,An Attention-Based Deep Learning Approach for Sleep Stage Classification With Single-Channel EEG,73,6,2021,"large ""language model"""
955,4506c9cd34a0b6f09fe23a3d9be0bc0962d14540,https://www.semanticscholar.org/paper/4506c9cd34a0b6f09fe23a3d9be0bc0962d14540,ZeRO-Infinity: Breaking the GPU Memory Wall for Extreme Scale Deep learning,81,7,2021,"large ""language model"""
956,c690e19db8aed43ab73e89fc728b51826af196c9,https://www.semanticscholar.org/paper/c690e19db8aed43ab73e89fc728b51826af196c9,Deep-Learning-Enabled Security Issues in the Internet of Things,64,3,2021,"large ""language model"""
957,5b5535418882e9543a33819592c5bf371e68b2c3,https://www.semanticscholar.org/paper/5b5535418882e9543a33819592c5bf371e68b2c3,The Principles of Deep Learning Theory,70,7,2021,"large ""language model"""
958,d70d16ca18570ee65f2065c740822e19d618421e,https://www.semanticscholar.org/paper/d70d16ca18570ee65f2065c740822e19d618421e,Adversarial Examples—Security Threats to COVID-19 Deep Learning Systems in Medical IoT Devices,72,3,2021,"large ""language model"""
959,8415db10a4e2354b7d57b75848f1485ce5d0e7ce,https://www.semanticscholar.org/paper/8415db10a4e2354b7d57b75848f1485ce5d0e7ce,Laplace Redux - Effortless Bayesian Deep Learning,62,7,2021,"large ""language model"""
960,1789af28ddac3eab9cf37f84146e48457f28ace3,https://www.semanticscholar.org/paper/1789af28ddac3eab9cf37f84146e48457f28ace3,Privacy and Security Issues in Deep Learning: A Survey,66,3,2021,"large ""language model"""
961,5c107f5aa33e3e5d3b3ea9dc17e04a51765b0983,https://www.semanticscholar.org/paper/5c107f5aa33e3e5d3b3ea9dc17e04a51765b0983,A review of medical image data augmentation techniques for deep learning applications,70,6,2021,"large ""language model"""
962,3ad3cbad4b73e8f84707e7c686bcfda9e3421cf3,https://www.semanticscholar.org/paper/3ad3cbad4b73e8f84707e7c686bcfda9e3421cf3,AI applications to medical images: From machine learning to deep learning.,101,3,2021,"large ""language model"""
963,52b1450ece3b2932c2cca2295c20a701f3e82dff,https://www.semanticscholar.org/paper/52b1450ece3b2932c2cca2295c20a701f3e82dff,Deep Learning on a Data Diet: Finding Important Examples Early in Training,57,17,2021,"large ""language model"""
964,3a62d3748b0778c72f68997444055c0a403429fd,https://www.semanticscholar.org/paper/3a62d3748b0778c72f68997444055c0a403429fd,Fit without fear: remarkable mathematical phenomena of deep learning through the prism of interpolation,54,6,2021,"large ""language model"""
965,ff091e91b74452924b1f8105731dbf15f358f875,https://www.semanticscholar.org/paper/ff091e91b74452924b1f8105731dbf15f358f875,Deep learning model to predict complex stress and strain fields in hierarchical composites,55,4,2021,"large ""language model"""
966,51546584aa394d159edcc08f2412ae30dd316f6c,https://www.semanticscholar.org/paper/51546584aa394d159edcc08f2412ae30dd316f6c,Deep Learning Through the Lens of Example Difficulty,47,4,2021,"large ""language model"""
967,a7b82c7b89f447031ec5c66fa837cb6754d4c6b7,https://www.semanticscholar.org/paper/a7b82c7b89f447031ec5c66fa837cb6754d4c6b7,Reinforcement Learning for Hyperparameter Tuning in Deep Learning-based Side-channel Analysis,46,4,2021,"large ""language model"""
968,245df7d8e53b3860107edc76b467e055eb80744d,https://www.semanticscholar.org/paper/245df7d8e53b3860107edc76b467e055eb80744d,Multi-institutional Collaborations for Improving Deep Learning-based Magnetic Resonance Image Reconstruction Using Federated Learning,46,4,2021,"large ""language model"""
969,eedb95b3d4e8f1be38eaf1a7416270df5852d117,https://www.semanticscholar.org/paper/eedb95b3d4e8f1be38eaf1a7416270df5852d117,DeepDSC: A Deep Learning Method to Predict Drug Sensitivity of Cancer Cell Lines,48,3,2021,"large ""language model"""
970,323ca85c5c1ebd0ec9bf74897d8c8e8fbf203ae6,https://www.semanticscholar.org/paper/323ca85c5c1ebd0ec9bf74897d8c8e8fbf203ae6,DIG: A Turnkey Library for Diving into Graph Deep Learning Research,46,6,2021,"large ""language model"""
971,80e8d5944dc367fa43626991515519fdfd9eb540,https://www.semanticscholar.org/paper/80e8d5944dc367fa43626991515519fdfd9eb540,Replay in Deep Learning: Current Approaches and Missing Biological Elements,45,3,2021,"large ""language model"""
972,70c43cf1c33f08e2eb6ae72fbc2201cfdda2dc9a,https://www.semanticscholar.org/paper/70c43cf1c33f08e2eb6ae72fbc2201cfdda2dc9a,"A review on deep learning in machining and tool monitoring: methods, opportunities, and challenges",45,4,2021,"large ""language model"""
973,042617bb4ca14ea10b1abdd99c7e45f581d47817,https://www.semanticscholar.org/paper/042617bb4ca14ea10b1abdd99c7e45f581d47817,Medical image fusion method by deep learning,144,1,2021,"large ""language model"""
974,faec7030c99bf2fa29d341bc09d351b7edfa05bc,https://www.semanticscholar.org/paper/faec7030c99bf2fa29d341bc09d351b7edfa05bc,Skin Cancer Detection: A Review Using Deep Learning Techniques,44,3,2021,"large ""language model"""
975,378ba59aa19b4e4591972988b753509f95126a2a,https://www.semanticscholar.org/paper/378ba59aa19b4e4591972988b753509f95126a2a,An annotation-free whole-slide training approach to pathological classification of lung cancer types using deep learning,44,3,2021,"large ""language model"""
976,9bbb61d9bcfa1a2b63efbdb8a521af8c8a2e94ec,https://www.semanticscholar.org/paper/9bbb61d9bcfa1a2b63efbdb8a521af8c8a2e94ec,End-to-end privacy preserving deep learning on multi-institutional medical imaging,95,6,2021,"large ""language model"""
977,7f0afe731f0073eb10df4cbab2a94aa9ecafe44f,https://www.semanticscholar.org/paper/7f0afe731f0073eb10df4cbab2a94aa9ecafe44f,"A survey on deep learning in medicine: Why, how and when?",110,1,2021,"large ""language model"""
978,1594c5c621ac97fc48d2f34ea479164fd750733c,https://www.semanticscholar.org/paper/1594c5c621ac97fc48d2f34ea479164fd750733c,Scalable Marginal Likelihood Estimation for Model Selection in Deep Learning,42,4,2021,"large ""language model"""
979,deb5c68a366bc4c311f6b06ffac80b998f00753a,https://www.semanticscholar.org/paper/deb5c68a366bc4c311f6b06ffac80b998f00753a,Training Spiking Neural Networks Using Lessons From Deep Learning,42,4,2021,"large ""language model"""
980,a29cb44f44a0780fbc7469768cbb9bbcde69fd35,https://www.semanticscholar.org/paper/a29cb44f44a0780fbc7469768cbb9bbcde69fd35,Deep Learning Based Code Smell Detection,41,8,2021,"large ""language model"""
981,a323533f5f50cfce949d47caac97f791cdf1bf92,https://www.semanticscholar.org/paper/a323533f5f50cfce949d47caac97f791cdf1bf92,Medical image analysis based on deep learning approach,42,3,2021,"large ""language model"""
982,8277eb8a4c799f06dc99556c33884aa01fd3c7bf,https://www.semanticscholar.org/paper/8277eb8a4c799f06dc99556c33884aa01fd3c7bf,Sentimental Analysis of COVID-19 Tweets Using Deep Learning Models,42,3,2021,"large ""language model"""
983,8ae37cd9f402d753ad284293a8e5186a6acef9d2,https://www.semanticscholar.org/paper/8ae37cd9f402d753ad284293a8e5186a6acef9d2,Quasi-Global Momentum: Accelerating Decentralized Deep Learning on Heterogeneous Data,39,5,2021,"large ""language model"""
984,09bd598fbfddb2f1de60912647ffe8f6e7c0cf53,https://www.semanticscholar.org/paper/09bd598fbfddb2f1de60912647ffe8f6e7c0cf53,DGL-LifeSci: An Open-Source Toolkit for Deep Learning on Graphs in Life Science,37,3,2021,"large ""language model"""
985,823deee03bc49c306170bee265446b5b7f95666f,https://www.semanticscholar.org/paper/823deee03bc49c306170bee265446b5b7f95666f,Measuring Robustness in Deep Learning Based Compressive Sensing,35,3,2021,"large ""language model"""
986,6291255977e6ee13a13bb7d024629561e9b99067,https://www.semanticscholar.org/paper/6291255977e6ee13a13bb7d024629561e9b99067,Data Poisoning Attacks to Deep Learning Based Recommender Systems,34,3,2021,"large ""language model"""
987,080c98d3284b60b78d15fbd2bd118623fe88c403,https://www.semanticscholar.org/paper/080c98d3284b60b78d15fbd2bd118623fe88c403,Sub‐Seasonal Forecasting With a Large Ensemble of Deep‐Learning Weather Prediction Models,34,5,2021,"large ""language model"""
988,4d024863a8b6c13319aec051b096f4f23f6ab989,https://www.semanticscholar.org/paper/4d024863a8b6c13319aec051b096f4f23f6ab989,Deep Learning-Based Semantic Segmentation of Urban Features in Satellite Images: A Review and Meta-Analysis,36,3,2021,"large ""language model"""
989,0c716ef1bf2a00c24dba3f7a7edc8f59efbc9cb2,https://www.semanticscholar.org/paper/0c716ef1bf2a00c24dba3f7a7edc8f59efbc9cb2,Pneumonia Classification Using Deep Learning from Chest X-ray Images During COVID-19,97,8,2021,"large ""language model"""
990,835e49a8c6c9a034cdde2fe5a43c5defe84d10e1,https://www.semanticscholar.org/paper/835e49a8c6c9a034cdde2fe5a43c5defe84d10e1,Classification of COVID-19 electrocardiograms by using hexaxial feature mapping and deep learning,32,6,2021,"large ""language model"""
991,9f39c824eeb4b16bd8422fc683e53c0db43ba7e9,https://www.semanticscholar.org/paper/9f39c824eeb4b16bd8422fc683e53c0db43ba7e9,Deep-learning based detection of COVID-19 using lung ultrasound imagery,33,4,2021,"large ""language model"""
992,15d06f25f1af95db15d7252dfdc953f176c68d52,https://www.semanticscholar.org/paper/15d06f25f1af95db15d7252dfdc953f176c68d52,Phishpedia: A Hybrid Deep Learning Based Approach to Visually Identify Phishing Webpages,31,3,2021,"large ""language model"""
